,article,author,journal,number,title,volume,topics,reviewed_by,journalID,editor,paperType,reviews,decisions,decisionID
0,884424,AndrewNealen|JohannesZimmermann|MarcAlexa,ComputGraph,5,Sketching contours.,32,sketchingcontours,ChristopherJHarper|JamesTheiler,6292,PatrickHochstenbachXuebinZheng,full_paper,exercitationem laboriosam repudiandae eos cum voluptate minus vero minima iste|iusto reprehenderit doloribus iste ratione iure dolore tempore quidem ex,Accepted|Accepted,review884424_0|review884424_1
1,1066027,HyeonjoonMoon|KanghunJeong,KSIITransInternetInfSyst,1,Efficient 3D Model based Face Representation and Recognition Algorithm using Pixel-to-Vertex Map (PVM).,5,pvm|algorithm|face,PabloChamoso|MengchuanZou,14775,QiangGuoMustafaCenkGursoy,demo_paper,amet eligendi magnam consequatur odio neque sunt dignissimos iusto aut|ut magni impedit earum ullam nam sunt minus iusto tempora,Accepted|Accepted,review1066027_0|review1066027_1
2,2730573,RameshChandra|VaibhavBhatnagar,IntJSocComputCyberPhysSyst,2,Cyber-squatting: a cyber crime more than an unethical act.,2,a|unethical|more,XinyuXing|JessicaLosego|LyndaCIkejimba|AndreasBurg,12295,YoshioAraiLeopoldoTeixeira,full_paper,pariatur magni quasi minus dolores delectus tenetur provident eaque corporis|qui assumenda consectetur aut tempora minus unde excepturi culpa nobis|tempore impedit in amet fugit quae repellendus incidunt dolorum delectus|excepturi ipsa asperiores voluptas nihil ipsum rerum quasi error omnis,Accepted|Accepted|Accepted|Accepted,review2730573_0|review2730573_1|review2730573_2|review2730573_3
3,2266697,EminIslamTatli,IEEETransInfForensicsSecur,8,Cracking More Password Hashes With Patterns.,10,with|cracking|more,YiminDou|CharlesAntnioNascimentoCosta|GeorgeSklivanitis|MichaelAMurphy,9770,PingFengTroelsMnsted,full_paper,labore magni repellat et rem voluptatibus totam amet maiores modi|necessitatibus eius itaque recusandae nam veniam qui excepturi maiores magnam|placeat in beatae ex aspernatur fugiat saepe harum quibusdam unde|eaque ipsa a ipsam libero voluptatem iure labore deleniti voluptas,Accepted|Accepted|Accepted|Accepted,review2266697_0|review2266697_1|review2266697_2|review2266697_3
4,174388,ShawnBowers,JDataSemant,1,"Scientific Workflow, Provenance, and Data Modeling Challenges and Approaches.",1,modeling|workflow|challenges,LiangDong|ToruAraki|ShiboHe|WeiLan,13433,KirillVNourskiHuaiqiuZhu,full_paper,obcaecati ut at aut vel qui laudantium deleniti fugiat quo|incidunt ipsam ea dicta earum odit consequatur architecto esse voluptates|culpa quod odit deserunt possimus quo nisi incidunt saepe porro|neque recusandae architecto dolorum voluptates asperiores tempore ratione voluptatum odit,Accepted|Accepted|Accepted|Accepted,review174388_0|review174388_1|review174388_2|review174388_3
